{"schemaVersion":1,"evidenceKind":"chronorift-m4-external-project-conformance-evidence","conformanceSpecSha256":"1fc43c0eaea45ed9fa129a7a2e06913c0cc37495633dc4d90dd3fd7598de5f82","profile":"chronorift-godot-lifecycle-v1","driver":{"kind":"deterministic-fake-pi","providerContacted":false},"source":{"declaredSourceUrl":"https://github.com/endlessm/moddable-platformer","headCommit":"3e793f53598a131c53fb82555191cc14b8db07ff","gitTreeObjectId":"a013bd677c712dbf354e8e2f6e8ff7c53d5684c6","selectedTreeSha256":"3e8bd6478d53586284010da38959005e2a377ef6277b2a838ecb1538abc096e8","entryCount":543,"declaredByteLength":1380343,"cleanBeforeTask":true,"unchangedAfterTask":true},"descriptor":{"sha256":"534dcd8aa14aeea74685059f8d66e44e5bebe21742b7a702ee7d78e91e1a955e","persistedBytesRevalidated":true},"toolchain":{"nodeVersion":"v22.23.1","godotVersion":"4.7.1.stable.official.a13da4feb"},"sandbox":{"networkMode":"loopback_only","storageFilesystem":"tmpfs","storageCapacityBytes":1073741824,"storageInodeCapacity":131072,"delegatedControllers":["cpu","memory","pids"],"sourceMountedReadOnly":true,"taskCredentialMountCount":0,"mountAdmissionReceiptCount":5,"mountAdmissionsSha256":"50dfe52316bb6efdc8ae85fd7f966e700f2addcecdec529d9c6f68a7be7f6c0d","taskSharedWritableTargets":["/tmp","/artifacts"]},"lifecycleTools":{"exposed":["game_capabilities","game_launch","game_status","game_stop"],"notExposed":["game_capture_configure","game_capture_pin","game_query","game_input","game_step","game_set_controls","game_checkpoint_create","game_checkpoint_restore","game_fork","game_trace_create","game_trace_replay","game_compare"]},"taskLifecycle":{"lifecycleOperationsObserved":["start","continue","show","export","discard"],"profilePreservedOnContinue":true},"runtime":{"import":{"exitCode":0,"timedOut":false,"durationMs":4796,"timingFidelity":"operation_bounds","stdout":{"totalSha256":"7aca1b2cb21df815852f7558813e75df7aa713d7eaf55884a26713887febdb4c","totalBytes":13241,"retainedBytes":13241,"truncated":false},"stderr":{"totalSha256":"e3b0c44298fc1c149afbf4c8996fb92427ae41e4649b934ca495991b7852b855","totalBytes":0,"retainedBytes":0,"truncated":false},"receiptSha256":"561a974efc32f916ce671497d6cf57154caa19d64ef970dd6669d7875077593e"},"vanilla":{"stabilityObservedMs":2008,"timingFidelity":"operation_bounds","timedOut":false,"stoppedByHarness":true,"stdout":{"totalSha256":"1f4aefb7bdaa3aac5c3ea38b8d505eb0d072d02dfef33d1c42767bcd075bbb24","totalBytes":73,"retainedBytes":73,"truncated":false},"stderr":{"totalSha256":"e3b0c44298fc1c149afbf4c8996fb92427ae41e4649b934ca495991b7852b855","totalBytes":0,"retainedBytes":0,"truncated":false},"receiptSha256":"f7bbb8a2e43f0f7634259438b72a17e68685941f7b2fc6585488e7479b83a115"},"overlay":{"protocolVersion":1,"handshakeObserved":true,"addonSha256":"75cdfec32235fff7f2ac42305baab3c30b146d2264d9c902811c81af95052abc","candidateSourceSha256":"8aa71e3ea1839fb4a56940b25a3b61bc747bf712ec7a7221cdb42ecaaeeb2336","engineVersion":"4.7.1-stable (official)","platform":"Linux","renderer":"gl_compatibility","configuredSceneMatched":true,"currentSceneMatched":true,"processFrameDelta":289,"physicsTickDelta":120,"hostMonotonicStartUs":55782316,"hostMonotonicEndUs":57783310,"diagnosticLossObserved":false,"receiptSha256":"72a447525202a6b4223a05261712c20337d239d2ec5529aefbd55b4fa3825d21"},"shutdown":{"finalStatus":"stopped","receiptSha256":"efd05227bc0eb2cc723065fba39ae73903525a4e44b698391fefaa34765c7bb9"}},"candidate":{"relativePath":"CHRONORIFT_ONBOARDING_SMOKE.md","mode":"100644","contentSha256":"04b0627d60c82e79178aaf7d8b9c7a7591a6bef635be21226e6cae6235b4089e","baselineSelectedTreeSha256":"3e8bd6478d53586284010da38959005e2a377ef6277b2a838ecb1538abc096e8","candidateSelectedTreeSha256":"8aa71e3ea1839fb4a56940b25a3b61bc747bf712ec7a7221cdb42ecaaeeb2336","exportedPatchSha256":"ab2c6a2bff77cec431596c0460a6ecffe8124aa9a2bbf89ae5cb7d4b20c6ea6b","roundTripSelectedTreeSha256":"8aa71e3ea1839fb4a56940b25a3b61bc747bf712ec7a7221cdb42ecaaeeb2336"},"cleanup":{"taskDiscarded":true,"taskProcessesEmpty":true,"taskCgroupsEmpty":true,"taskStorageEmpty":true}}
